<?xml version="1.0" encoding="UTF-8"?>
<mapping xmlns:xsi="http://www.w3.org/2001/XMLSchema-instance"
    xsi:noNamespaceSchemaLocation="../../../webapi/src/main/resources/mappingXMLToStandoff.xsd">
    <mappingElement>
        <tag>
            <name>x</name>
            <class>noClass</class>
            <namespace>noNamespace</namespace>
            <separatesWords>false</separatesWords>
        </tag>
        <standoffClass>
            <classIri>http://www.knora.org/ontology/standoff#StandoffRootTag</classIri>
            <attributes>
                <attribute>
                    <attributeName>documentType</attributeName>
                    <namespace>noNamespace</namespace>
                    <propertyIri>http://www.knora.org/ontology/standoff#standoffRootTagHasDocumentType</propertyIri>
                </attribute>
            </attributes>
        </standoffClass>
    </mappingElement>

</mapping>
